{
  "workflow": "speckit-companion",
  "specName": "Living Specs — Tiered consumption: arch + coverage (LS·8)",
  "branch": "379-living-specs-tiered-consumption",
  "selectedAt": "2026-06-25T00:00:00.000Z",
  "currentStep": "implement",
  "status": "completed",
  "history": [
    {
      "step": "specify",
      "substep": null,
      "kind": "start",
      "from": {
        "step": null,
        "substep": null
      },
      "by": "extension",
      "at": "2026-06-25T00:00:00.000Z"
    },
    {
      "step": "specify",
      "substep": null,
      "kind": "complete",
      "by": "ai",
      "at": "2026-06-25T00:05:00.000Z"
    },
    {
      "step": "plan",
      "substep": null,
      "kind": "start",
      "from": {
        "step": "specify",
        "substep": null
      },
      "by": "extension",
      "at": "2026-06-25T00:05:00.000Z"
    },
    {
      "step": "plan",
      "substep": null,
      "kind": "complete",
      "by": "ai",
      "at": "2026-06-25T00:10:00.000Z"
    },
    {
      "step": "tasks",
      "substep": null,
      "kind": "start",
      "from": {
        "step": "plan",
        "substep": null
      },
      "by": "extension",
      "at": "2026-06-25T00:10:00.000Z"
    },
    {
      "step": "tasks",
      "substep": null,
      "kind": "complete",
      "by": "ai",
      "at": "2026-06-25T00:15:00.000Z"
    },
    {
      "step": "implement",
      "substep": null,
      "kind": "start",
      "from": {
        "step": "tasks",
        "substep": null
      },
      "by": "extension",
      "at": "2026-06-25T00:15:00.000Z"
    },
    {
      "step": "implement",
      "substep": null,
      "kind": "complete",
      "by": "ai",
      "at": "2026-06-25T00:30:00.000Z"
    }
  ]
}