{
  "workflow": "speckit",
  "specName": "Round3 State Followup",
  "branch": "fix/round-3-state-cleanup-v2",
  "selectedAt": "2026-05-27T13:56:53.459Z",
  "currentStep": "implement",
  "status": "completed",
  "history": [
    {
      "step": "specify",
      "substep": null,
      "kind": "start",
      "from": {
        "step": null,
        "substep": null
      },
      "by": "extension",
      "at": "2026-05-27T13:56:53.459Z"
    },
    {
      "step": "specify",
      "substep": null,
      "kind": "complete",
      "by": "ai",
      "at": "2026-05-27T13:59:46Z"
    },
    {
      "step": "plan",
      "substep": null,
      "kind": "start",
      "from": {
        "step": "specify",
        "substep": null
      },
      "by": "extension",
      "at": "2026-05-27T14:01:14.289Z"
    },
    {
      "step": "plan",
      "substep": null,
      "kind": "complete",
      "by": "ai",
      "at": "2026-05-27T14:07:31Z"
    },
    {
      "step": "tasks",
      "substep": null,
      "kind": "start",
      "from": {
        "step": "plan",
        "substep": null
      },
      "by": "extension",
      "at": "2026-05-27T14:09:42.815Z"
    },
    {
      "step": "tasks",
      "substep": null,
      "kind": "complete",
      "by": "ai",
      "at": "2026-05-27T14:11:03Z"
    },
    {
      "step": "implement",
      "substep": null,
      "kind": "start",
      "from": {
        "step": "tasks",
        "substep": null
      },
      "by": "extension",
      "at": "2026-05-27T14:18:52.348Z"
    },
    {
      "step": "implement",
      "substep": null,
      "kind": "complete",
      "by": "ai",
      "at": "2026-05-27T14:24:20Z"
    },
    {
      "step": "implement",
      "substep": null,
      "kind": "complete",
      "by": "user",
      "at": "2026-05-27T14:31:49Z"
    }
  ]
}
