{
  "workflow": "companion",
  "specName": "Records Disagree",
  "branch": "fixture",
  "currentStep": "specify",
  "status": "specified",
  "history": [
    {
      "step": "specify",
      "substep": null,
      "kind": "start",
      "by": "extension",
      "at": "2026-08-01T10:00:00Z"
    }
  ]
}
