{
  "workflow": "speckit",
  "specName": "Demo — Tasked",
  "branch": "demo/tasked",
  "selectedAt": "2026-05-20T20:00:00.000Z",
  "currentStep": "tasks",
  "status": "ready-to-implement",
  "history": [
    {
      "step": "specify",
      "substep": null,
      "kind": "start",
      "from": {
        "step": null,
        "substep": null
      },
      "by": "extension",
      "at": "2026-05-20T20:00:00.000Z"
    },
    {
      "step": "specify",
      "substep": null,
      "kind": "complete",
      "by": "ai",
      "at": "2026-05-20T20:05:00.000Z"
    },
    {
      "step": "plan",
      "substep": null,
      "kind": "start",
      "from": {
        "step": "specify",
        "substep": null
      },
      "by": "extension",
      "at": "2026-05-20T20:05:00.000Z"
    },
    {
      "step": "plan",
      "substep": null,
      "kind": "complete",
      "by": "ai",
      "at": "2026-05-20T20:10:00.000Z"
    },
    {
      "step": "tasks",
      "substep": null,
      "kind": "start",
      "from": {
        "step": "plan",
        "substep": null
      },
      "by": "extension",
      "at": "2026-05-20T20:10:00.000Z"
    },
    {
      "step": "tasks",
      "substep": null,
      "kind": "complete",
      "by": "ai",
      "at": "2026-05-20T20:15:00.000Z"
    }
  ]
}